{
  "$schema": "../schema/verb-set.schema.json",
  "id": "ja-ramen",
  "name": "Ramen",
  "emoji": "🍜",
  "description": "A bowl of ramen coming together, one step at a time",
  "language": "ja",
  "category": "meme",
  "tags": [
    "food",
    "ramen",
    "japanese"
  ],
  "verbs": [
    "スープを炊いています",
    "豚骨を炊き出しています",
    "鶏ガラを煮込んでいます",
    "節を効かせています",
    "醤油ダレを合わせています",
    "香味油を回しています",
    "麺を打っています",
    "加水率を調整しています",
    "麺を茹でています",
    "湯切りしています",
    "チャーシューを炙っています",
    "煮玉子を漬けています",
    "メンマを仕込んでいます",
    "海苔を添えています",
    "青ネギを刻んでいます",
    "背脂を散らしています",
    "丼を温めています",
    "味を調えています",
    "替え玉を用意しています",
    "行列に並んでいます",
    "券売機と睨み合っています",
    "ニンニクを入れています",
    "全マシにしています",
    "スープを飲み干しています",
    "ごちそうさまと言っています"
  ]
}
