{
  "$schema": "../schema/verb-set.schema.json",
  "id": "ja-general",
  "name": "Japanese Everyday",
  "emoji": "🗾",
  "description": "A general-purpose Japanese replacement for the 186 built-in verbs",
  "language": "ja",
  "category": "classic",
  "tags": [
    "japanese",
    "general"
  ],
  "verbs": [
    "考えています",
    "組み立てています",
    "読み解いています",
    "練り上げています",
    "磨いています",
    "掘り進めています",
    "紡いでいます",
    "仕込んでいます",
    "温めています",
    "煮詰めています",
    "見極めています",
    "積み上げています",
    "束ねています",
    "整えています",
    "研いでいます",
    "描いています",
    "探っています",
    "手繰っています",
    "咀嚼しています",
    "熟成させています",
    "発酵させています",
    "醸しています",
    "鍛えています",
    "彫っています",
    "織っています",
    "均しています",
    "漉しています",
    "焙じています",
    "捏ねています",
    "捌いています",
    "数えています",
    "測っています",
    "見立てています",
    "勘案しています",
    "逡巡しています",
    "吟味しています",
    "俯瞰しています",
    "咲かせています",
    "芽吹かせています",
    "腹を括っています"
  ]
}
